{
  "manifest_id": "QDPMAN-088D491C7270F7F6",
  "candidate_id": "m06-case-7",
  "candidate_path": "artifacts\\outputs\\m06\\bootstrap\\run_1\\CASE_7_CONFIRMED_READY_BRANCH\\CASE_7_CONFIRMED_READY_BRANCH_candidate.json",
  "candidate_sha256": "5be1fa7a9269f2d7e8bf06af3ba001dcc1e6e1d2f5c181d720c614e8fbeb2139",
  "linked_artifacts": [
    {
      "path": "specs\\core\\bath_glossary.md",
      "sha256": "5df3b4b4a12df7bbf460606ea573adab562c3b91b372da1dd95ff261fa99a680"
    },
    {
      "path": "specs\\core\\signature_to_bath_decision_chart.md",
      "sha256": "cfa12a2292755b236e09f2fa3a67d325f3131bcfbd41a1e2286715e02c4622bd"
    },
    {
      "path": "specs\\research\\deep_research_report.md",
      "sha256": "6fe8482b2ad2c6abbedc691444a7c39a97c20d2cd5566e3fd7db7e628f381fe6"
    },
    {
      "path": "specs\\intake\\fork_intake_form_one_page.pdf",
      "sha256": "3a86e3137169dba080875a7e6f5037f457609cf8996ee3bd043283e91cc96666"
    }
  ]
}